{
  "schemaVersion": "1.0",
  "id": "qmt-broker",
  "version": "0.1.1",
  "name": {
    "cn": "QMT 实盘券商",
    "en": "QMT Broker"
  },
  "description": {
    "cn": "通过本地 MiniQMT 和 xtquant 连接 A 股实盘券商，用于策略交易执行。",
    "en": "Live broker connector for A-share strategy trading through local MiniQMT and xtquant."
  },
  "repo": "https://github.com/yeying-community/marketplace/tree/main/tools/packages/qmt-broker-mcp",
  "tags": ["community", "broker", "trading", "qmt", "live-trading", "a-share"],
  "command": "npx",
  "baseArgs": ["-y", "@yeying-community/qmt-broker-mcp", "--transport", "stdio"],
  "runtimes": ["standalone", "desktop"],
  "platforms": ["windows"],
  "permissions": [
    {
      "id": "local-trading",
      "description": {
        "cn": "访问本机 MiniQMT 与 xtquant；若启用实盘配置，可能提交真实交易订单。",
        "en": "Access local MiniQMT and xtquant; live-trading settings may submit real orders."
      }
    }
  ],
  "requirements": [
    {
      "cn": "仅支持 Windows；需要 Node.js、MiniQMT 和 xtquant。",
      "en": "Windows only; requires Node.js, MiniQMT, and xtquant."
    }
  ],
  "configurable": true,
  "configSchema": {
    "properties": {
      "qmtUserdataPath": {
        "type": "string",
        "description": {
          "cn": "MiniQMT userdata_mini 路径，例如 D:\\QMT\\userdata_mini。",
          "en": "MiniQMT userdata_mini path, for example D:\\QMT\\userdata_mini."
        },
        "required": true
        ,"sensitive": true
      },
      "accountId": {
        "type": "string",
        "description": {
          "cn": "券商资金账号。",
          "en": "Broker fund account id."
        },
        "required": true
      },
      "accountType": {
        "type": "string",
        "description": {
          "cn": "QMT 账号类型，通常是 STOCK 或 CREDIT。",
          "en": "QMT account type, usually STOCK or CREDIT."
        },
        "required": false
      },
      "pythonCommand": {
        "type": "string",
        "description": {
          "cn": "已安装 xtquant 的 Python 命令，例如 python 或 python3。",
          "en": "Python command with xtquant installed, for example python or python3."
        },
        "required": false
      },
      "enableLiveTrading": {
        "type": "boolean",
        "description": {
          "cn": "启用真实下单。账号、风控和确认流程验证完成前请保持关闭。",
          "en": "Enable real order submission. Keep disabled until account, risk controls, and confirmation flow are verified."
        },
        "required": true
      },
      "requireConfirmation": {
        "type": "boolean",
        "description": {
          "cn": "place_order 是否要求 confirmed=true，默认开启。",
          "en": "Require confirmed=true for place_order. Enabled by default."
        },
        "required": false
      }
    }
  },
  "argsMapping": {
    "qmtUserdataPath": {
      "type": "env",
      "key": "QMT_USERDATA_PATH"
    },
    "accountId": {
      "type": "env",
      "key": "QMT_ACCOUNT_ID"
    },
    "accountType": {
      "type": "env",
      "key": "QMT_ACCOUNT_TYPE"
    },
    "pythonCommand": {
      "type": "env",
      "key": "QMT_PYTHON"
    },
    "enableLiveTrading": {
      "type": "env",
      "key": "QMT_ENABLE_LIVE_TRADING"
    },
    "requireConfirmation": {
      "type": "env",
      "key": "QMT_REQUIRE_CONFIRMATION"
    }
  },
  "release": {
    "status": "published",
    "review": "approved"
  }
}
