{
  "schemaVersion": "1.0",
  "id": "ifind-data",
  "version": "0.1.0",
  "name": {
    "cn": "同花顺 iFinD 数据",
    "en": "iFinD Data"
  },
  "description": {
    "cn": "同花顺 iFinD / QuantAPI 行情数据连接器，用于策略调研、信号生成和交易前检查。",
    "en": "TongHuaShun iFinD / QuantAPI market data connector for strategy research, signals, and pre-trade checks."
  },
  "repo": "https://github.com/yeying-community/marketplace/tree/main/tools/packages/ifind-data-mcp",
  "tags": ["community", "market-data", "ifind", "quantapi", "tonghuashun", "trading"],
  "command": "npx",
  "baseArgs": ["-y", "@yeying-community/ifind-data-mcp", "--transport", "stdio"],
  "runtimes": ["standalone", "desktop"],
  "platforms": ["macos", "windows", "linux"],
  "permissions": [
    {
      "id": "network",
      "description": {
        "cn": "连接 iFinD / QuantAPI 服务读取行情数据。",
        "en": "Connect to iFinD / QuantAPI services to read market data."
      }
    },
    {
      "id": "account-token",
      "description": {
        "cn": "使用你提供的 iFinD API Token。",
        "en": "Use the iFinD API token you provide."
      }
    }
  ],
  "requirements": [
    {
      "cn": "需要已安装 Node.js 和可用的 npx 命令。",
      "en": "Requires Node.js and the npx command to be available."
    }
  ],
  "configurable": true,
  "configSchema": {
    "properties": {
      "refreshToken": {
        "type": "string",
        "description": {
          "cn": "iFinD / QuantAPI refresh_token，用于获取 access_token。",
          "en": "iFinD / QuantAPI refresh_token. Used to obtain access_token."
        },
        "required": true,
        "sensitive": true,
        "helpUrl": "https://quantapi.10jqka.com.cn/gwstatic/static/ds_web/super-command-web/index.html#/AccountDetails",
        "helpLabel": {
          "cn": "获取 refresh_token",
          "en": "Get refresh_token"
        }
      },
      "accessToken": {
        "type": "string",
        "description": {
          "cn": "可选的已有 access_token；不填写时使用 refreshToken 自动获取。",
          "en": "Optional existing access_token. If omitted, refreshToken is used."
        },
        "required": false
        ,"sensitive": true
      },
      "baseUrl": {
        "type": "string",
        "description": {
          "cn": "QuantAPI HTTP 基础地址，默认 https://quantapi.51ifind.com/api/v1。",
          "en": "QuantAPI HTTP base URL. Defaults to https://quantapi.51ifind.com/api/v1."
        },
        "required": false
      },
      "requestTimeoutMs": {
        "type": "string",
        "description": {
          "cn": "HTTP 请求超时时间，单位毫秒，默认 30000。",
          "en": "HTTP request timeout in milliseconds. Defaults to 30000."
        },
        "required": false
      }
    }
  },
  "argsMapping": {
    "refreshToken": {
      "type": "env",
      "key": "IFIND_REFRESH_TOKEN"
    },
    "accessToken": {
      "type": "env",
      "key": "IFIND_ACCESS_TOKEN"
    },
    "baseUrl": {
      "type": "env",
      "key": "IFIND_BASE_URL"
    },
    "requestTimeoutMs": {
      "type": "env",
      "key": "IFIND_REQUEST_TIMEOUT_MS"
    }
  },
  "release": {
    "status": "published",
    "review": "approved"
  }
}
